Chunks,NLTK,spaCy,NLTK U spaCy,No_Names
"t
Greenwich pensioners wheezing by the firesides of their wards fog
in the stem and bowl of the afternoon pipe of the wrathful skipper
down in his close cabin fog cruelly pinching the toes and fingers of
his shivering little prentice boy on deck Chance people on the
bridges peeping over the parapets into a nether sky of fog with fog
all round them as if they were up in a balloon and hanging in the
misty clouds

Gas looming through the fog in divers places in the streets much as
the sun may from ",F,F,F,True
"in
his High Court of Chancery

Never can there come fog too thick never can there come mud and mire
too deep to assort with the groping and floundering condition which
this High Court of Chancery most pestilent of hoary sinners holds
this day in the sight of heaven and earth

On such an afternoon if ever the Lord High Chancellor ought to be
sitting hereas here he iswith a foggy glory round his head
softly fenced in with crimson cloth and curtains addressed by a
large advocate with great whiskers",F,F,F,True
" a little voice and an
interminable brief and outwardly directing his contemplation to the
lantern in the roof where he can see nothing but fog On such an
afternoon some score of members of the High Court of Chancery bar
ought to beas here they aremistily engaged in one of the ten
thousand stages of an endless cause tripping one another up on
slippery precedents groping kneedeep in technicalities running
their goathair and horsehair warded heads against walls of words and
making a pretence of eq",F,F,F,True
"uity with serious faces as players might On
such an afternoon the various solicitors in the cause some two or
three of whom have inherited it from their fathers who made a
fortune by it ought to beas are they notranged in a line in a
long matted well but you might look in vain for truth at the bottom
of it between the registrars red table and the silk gowns with
bills crossbills answers rejoinders injunctions affidavits
issues references to masters masters reports mountains of costly
nonsense pi",F,F,F,True
"led before them Well may the court be dim with wasting
candles here and there well may the fog hang heavy in it as if it
would never get out well may the stainedglass windows lose their
colour and admit no light of day into the place well may the
uninitiated from the streets who peep in through the glass panes in
the door be deterred from entrance by its owlish aspect and by the
drawl languidly echoing to the roof from the padded dais where the
Lord High Chancellor looks into the lantern that ha",F,F,F,True
"s no light in it
and where the attendant wigs are all stuck in a fogbank This is the
Court of Chancery which has its decaying houses and its blighted
lands in every shire which has its wornout lunatic in every
madhouse and its dead in every churchyard which has its ruined
suitor with his slipshod heels and threadbare dress borrowing and
begging through the round of every mans acquaintance which gives to
monied might the means abundantly of wearying out the right which so
exhausts finances patien",F,F,F,True
"etter to peer into the curtained
sanctuary is a little mad old woman in a squeezed bonnet who is
always in court from its sitting to its rising and always expecting
some incomprehensible judgment to be given in her favour Some say
she really is or was a party to a suit but no one knows for
certain because no one cares She carries some small litter in a
reticule which she calls her documents principally consisting of
paper matches and dry lavender A sallow prisoner has come up in
custody for the ",F,F,F,True
"halfdozenth time to make a personal application to
purge himself of his contempt which being a solitary surviving
executor who has fallen into a state of conglomeration about accounts
of which it is not pretended that he had ever any knowledge he is
not at all likely ever to do In the meantime his prospects in life
are ended Another ruined suitor who periodically appears from
Shropshire and breaks out into efforts to address the Chancellor at
the close of the days business and who can by no mean",F,F,F,True
"rafters of the roof the very little counsel drops and the fog
knows him no more Everybody looks for him Nobody can see him

I will speak with both the young people says the Chancellor anew
and satisfy myself on the subject of their residing with their
cousin I will mention the matter tomorrow morning when I take my
seat

The Chancellor is about to bow to the bar when the prisoner is
presented Nothing can possibly come of the prisoners conglomeration
but his being sent back to prison which is soo",F,F,F,True
"n done The man from
Shropshire ventures another remonstrative My lord but the
Chancellor being aware of him has dexterously vanished Everybody
else quickly vanishes too A battery of blue bags is loaded with
heavy charges of papers and carried off by clerks the little mad old
woman marches off with her documents the empty court is locked up
If all the injustice it has committed and all the misery it has
caused could only be locked up with it and the whole burnt away in a
great funeral pyrewhy so ",F,F,F,True
"ies whom the
knight will wake one day when all the stopped spits in the kitchen
shall begin to turn prodigiously

It is not a large world Relatively even to this world of ours which
has its limits too as your Highness shall find when you have made
the tour of it and are come to the brink of the void beyond it is a
very little speck There is much good in it there are many good and
true people in it it has its appointed place But the evil of it is
that it is a world wrapped up in too much jeweller",F,F,F,True
" without hills but would be done up without Dedlocks He would on
the whole admit nature to be a good idea a little low perhaps when
not enclosed with a parkfence but an idea dependent for its
execution on your great county families He is a gentleman of strict
conscience disdainful of all littleness and meanness and ready on
the shortest notice to die any death you may please to mention rather
than give occasion for the least impeachment of his integrity He is
an honourable obstinate truthful hig",F,F,F,True
"ffled by interest or satisfaction are the
trophies of her victory She is perfectly wellbred If she could be
translated to heaven tomorrow she might be expected to ascend
without any rapture

She has beauty still and if it be not in its heyday it is not yet
in its autumn She has a fine faceoriginally of a character that
would be rather called very pretty than handsome but improved into
classicality by the acquired expression of her fashionable state Her
figure is elegant and has the effect of bei",F,F,F,True
"ure for Paris where her ladyship intends to stay some weeks
after which her movements are uncertain And at her house in town
upon this muddy murky afternoon presents himself an oldfashioned
old gentleman attorneyatlaw and eke solicitor of the High Court of
Chancery who has the honour of acting as legal adviser of the
Dedlocks and has as many castiron boxes in his office with that name
outside as if the present baronet were the coin of the conjurors
trick and were constantly being juggled through",F,F,F,True
" the whole set Across
the hall and up the stairs and along the passages and through the
rooms which are very brilliant in the season and very dismal out of
itfairyland to visit but a desert to live inthe old gentleman
is conducted by a Mercury in powder to my Ladys presence

The old gentleman is rusty to look at but is reputed to have made
good thrift out of aristocratic marriage settlements and aristocratic
wills and to be very rich He is surrounded by a mysterious halo of
family confidences of",F,F,F,True
" which he is known to be the silent depository
There are noble mausoleums rooted for centuries in retired glades of
parks among the growing timber and the fern which perhaps hold fewer
noble secrets than walk abroad among men shut up in the breast of
Mr Tulkinghorn He is of what is called the old schoola phrase
generally meaning any school that seems never to have been youngand
wears kneebreeches tied with ribbons and gaiters or stockings One
peculiarity of his black clothes and of his black sto",F,F,F,True
"knew that I can
remember when I was a very little girl indeed I used to say to my
doll when we were alone together Now Dolly I am not clever you
know very well and you must be patient with me like a dear And so
she used to sit propped up in a great armchair with her beautiful
complexion and rosy lips staring at meor not so much at me I
think as at nothingwhile I busily stitched away and told her every
one of my secrets

My dear old doll I was such a shy little thing that I seldom dared
to open m",F,F,F,True
"y lips and never dared to open my heart to anybody else
It almost makes me cry to think what a relief it used to be to me
when I came home from school of a day to run upstairs to my room and
say Oh you dear faithful Dolly I knew you would be expecting me
and then to sit down on the floor leaning on the elbow of her great
chair and tell her all I had noticed since we parted I had always
rather a noticing waynot a quick way oh noa silent way of
noticing what passed before me and thinking I should ",F,F,F,True
"like to
understand it better I have not by any means a quick understanding
When I love a person very tenderly indeed it seems to brighten But
even that may be my vanity

I was brought up from my earliest remembrancelike some of the
princesses in the fairy stories only I was not charmingby my
godmother At least I only knew her as such She was a good good
woman She went to church three times every Sunday and to morning
prayers on Wednesdays and Fridays and to lectures whenever there
were lectures ",F,F,F,True
"and never missed She was handsome and if she had
ever smiled would have been I used to think like an angelbut she
never smiled She was always grave and strict She was so very good
herself I thought that the badness of other people made her frown
all her life I felt so different from her even making every
allowance for the differences between a child and a woman I felt so
poor so trifling and so far off that I never could be unrestrained
with herno could never even love her as I wished It made me",F,F,F,True
" very
sorry to consider how good she was and how unworthy of her I was and
I used ardently to hope that I might have a better heart and I
talked it over very often with the dear old doll but I never loved
my godmother as I ought to have loved her and as I felt I must have
loved her if I had been a better girl

This made me I dare say more timid and retiring than I naturally
was and cast me upon Dolly as the only friend with whom I felt at
ease But something happened when I was still quite a litt",F,F,F,True
"in the first week of my going to the school
I remember it very well invited me home to a little party to my
great joy But my godmother wrote a stiff letter declining for me
and I never went I never went out at all

It was my birthday There were holidays at school on other
birthdaysnone on mine There were rejoicings at home on other
birthdays as I knew from what I heard the girls relate to one
anotherthere were none on mine My birthday was the most melancholy
day at home in the whole year

I have",F,F,F,True
" was greater than you will ever
knowthan any one will ever know but I the sufferer For yourself
unfortunate girl orphaned and degraded from the first of these evil
anniversaries pray daily that the sins of others be not visited upon
your head according to what is written Forget your mother and leave
all other people to forget her who will do her unhappy child that
greatest kindness Now go

She checked me however as I was about to depart from herso frozen
as I wasand added this Submission selfden",F,F,F,True
"to shed these tears as I think of it I am very
thankful I am very cheerful but I cannot quite help their coming to
my eyes

There I have wiped them away now and can go on again properly

I felt the distance between my godmother and myself so much more
after the birthday and felt so sensible of filling a place in her
house which ought to have been empty that I found her more difficult
of approach though I was fervently grateful to her in my heart than
ever I felt in the same way towards my school",F,F,F,True
"
what I say unto you I say unto all Watch

In an instant while she stood before me repeating these words she
fell down on the floor I had no need to cry out her voice had
sounded through the house and been heard in the street

She was laid upon her bed For more than a week she lay there little
altered outwardly with her old handsome resolute frown that I so
well knew carved upon her face Many and many a time in the day and
in the night with my head upon the pillow by her that my whispers
might b",F,F,F,True
"yce he went on makes no condition beyond expressing his
expectation that our young friend will not at any time remove herself
from the establishment in question without his knowledge and
concurrence That she will faithfully apply herself to the
acquisition of those accomplishments upon the exercise of which she
will be ultimately dependent That she will tread in the paths of
virtue and honour andtheaso forth

I was still less able to speak than before

Now what does our young friend say proceede",F,F,F,True
"any emotion at parting but I was
not so good and wept bitterly I thought that I ought to have known
her better after so many years and ought to have made myself enough
of a favourite with her to make her sorry then When she gave me one
cold parting kiss upon my forehead like a thawdrop from the stone
porchit was a very frosty dayI felt so miserable and
selfreproachful that I clung to her and told her it was my fault I
knew that she could say goodbye so easily

No Esther she returned It is your m",F,F,F,True
"d the fields all smooth and white with last nights snow and
the sun so red but yielding so little heat and the ice dark like
metal where the skaters and sliders had brushed the snow away There
was a gentleman in the coach who sat on the opposite seat and looked
very large in a quantity of wrappings but he sat gazing out of the
other window and took no notice of me

I thought of my dead godmother of the night when I read to her of
her frowning so fixedly and sternly in her bed of the strange plac",F,F,F,True
"e
I was going to of the people I should find there and what they
would be like and what they would say to me when a voice in the
coach gave me a terrible start

It said What the devil are you crying for

I was so frightened that I lost my voice and could only answer in a
whisper Me sir For of course I knew it must have been the
gentleman in the quantity of wrappings though he was still looking
out of his window

Yes you he said turning round

I didnt know I was crying sir I faltered

But you are",F,F,F,True
"case from the first As I began to know more I taught more
and so in course of time I had plenty to do which I was very fond of
doing because it made the dear girls fond of me At last whenever a
new pupil came who was a little downcast and unhappy she was so
sureindeed I dont know whyto make a friend of me that all
newcomers were confided to my care They said I was so gentle but I
am sure THEY were I often thought of the resolution I had made on my
birthday to try to be industrious contented and ",F,F,F,True
"truehearted and to
do some good to some one and win some love if I could and indeed
indeed I felt almost ashamed to have done so little and have won so
much

I passed at Greenleaf six happy quiet years I never saw in any face
there thank heaven on my birthday that it would have been better
if I had never been born When the day came round it brought me so
many tokens of affectionate remembrance that my room was beautiful
with them from New Years Day to Christmas

In those six years I had never be",F,F,F,True
"forgotten me to have made my
orphan way so smooth and easy and to have inclined so many youthful
natures towards me that I could hardly bear it Not that I would
have had them less sorryI am afraid not but the pleasure of it
and the pain of it and the pride and joy of it and the humble
regret of it were so blended that my heart seemed almost breaking
while it was full of rapture

The letter gave me only five days notice of my removal When every
minute added to the proofs of love and kindness that",F,F,F,True
"suaded that we were there when we were ten miles off
and when we really were there that we should never get there
However when we began to jolt upon a stone pavement and
particularly when every other conveyance seemed to be running into
us and we seemed to be running into every other conveyance I began
to believe that we really were approaching the end of our journey
Very soon afterwards we stopped

A young gentleman who had inked himself by accident addressed me from
the pavement and said I am ",F,F,F,True
"nge and Carboys The young gentleman showed me through an
outer office into Mr Kenges roomthere was no one in itand
politely put an armchair for me by the fire He then called my
attention to a little lookingglass hanging from a nail on one side
of the chimneypiece

In case you should wish to look at yourself miss after the
journey as youre going before the Chancellor Not that its
requisite I am sure said the young gentleman civilly

Going before the Chancellor I said startled for a moment

Only a",F,F,F,True
"hat
they meant and found myself reading the same words repeatedly As it
was of no use going on in that way I put the paper down took a peep
at my bonnet in the glass to see if it was neat and looked at the
room which was not half lighted and at the shabby dusty tables
and at the piles of writings and at a bookcase full of the most
inexpressivelooking books that ever had anything to say for
themselves Then I went on thinking thinking thinking and the
fire went on burning burning burning and the c",F,F,F,True
" with a latticework of
staylacelike a summerhouse

The room which was strewn with papers and nearly filled by a great
writingtable covered with similar litter was I must say not only
very untidy but very dirty We were obliged to take notice of that
with our sense of sight even while with our sense of hearing we
followed the poor child who had tumbled downstairs I think into the
back kitchen where somebody seemed to stifle him

But what principally struck us was a jaded and unhealthylooking
thoug",F,F,F,True
"hich made the room taste
strongly of hot tallow the fire had gone out and there was nothing
in the grate but ashes a bundle of wood and a poker you find me
my dears as usual very busy but that you will excuse The African
project at present employs my whole time It involves me in
correspondence with public bodies and with private individuals
anxious for the welfare of their species all over the country I am
happy to say it is advancing We hope by this time next year to have
from a hundred and fif",F,F,F,True
"n this afternoon and see me able to do nothing
else It was like your ill nature Yet you think yourselves very
fine I dare say

I could see that the poor girl was near crying and I resumed my
chair without speaking and looked at her I hope as mildly as I felt
towards her

Its disgraceful she said You know it is The whole house is
disgraceful The children are disgraceful IM disgraceful Pas
miserable and no wonder Priscilla drinksshes always drinking
Its a great shame and a great story of you if yo",F,F,F,True
" wish we were all dead It
would be a great deal better for us

In a moment afterwards she knelt on the ground at my side hid her
face in my dress passionately begged my pardon and wept I
comforted her and would have raised her but she cried no no she
wanted to stay there

You used to teach girls she said If you could only have taught
me I could have learnt from you I am so very miserable and I like
you so much

I could not persuade her to sit by me or to do anything but move a
ragged stool to wh",F,F,F,True
"ere she was kneeling and take that and still hold
my dress in the same manner By degrees the poor tired girl fell
asleep and then I contrived to raise her head so that it should rest
on my lap and to cover us both with shawls The fire went out and
all night long she slumbered thus before the ashy grate At first I
was painfully awake and vainly tried to lose myself with my eyes
closed among the scenes of the day At length by slow degrees they
became indistinct and mingled I began to lose the iden",F,F,F,True
"umouring her for a few moments before she
was at home Slipping us out at a little side gate the old lady
stopped most unexpectedly in a narrow back street part of some
courts and lanes immediately outside the wall of the inn and said
This is my lodging Pray walk up

She had stopped at a shop over which was written KROOK RAG AND
BOTTLE WAREHOUSE Also in long thin letters KROOK DEALER IN MARINE
STORES In one part of the window was a picture of a red paper mill
at which a cart was unloading a quant",F,F,F,True
"ity of sacks of old rags In
another was the inscription BONES BOUGHT In another KITCHENSTUFF
BOUGHT In another OLD IRON BOUGHT In another WASTEPAPER BOUGHT
In another LADIES AND GENTLEMENS WARDROBES BOUGHT Everything
seemed to be bought and nothing to be sold there In all parts of the
window were quantities of dirty bottlesblacking bottles medicine
bottles gingerbeer and sodawater bottles pickle bottles wine
bottles ink bottles I am reminded by mentioning the latter that the
shop had in several ",F,F,F,True
"rror

He come in at the door said the old man slowly pointing an
imaginary track along the shop on the day he did itthe whole
neighbourhood had said for months before that he would do it of a
certainty sooner or laterhe come in at the door that day and
walked along there and sat himself on a bench that stood there and
asked me youll judge I was a mortal sight younger then to fetch
him a pint of wine For says he Krook I am much depressed my
cause is on again and I think Im nearer judgment than I ",F,F,F,True
"scarcely less
pale Nor could I wonder judging even from my emotions and I was no
party in the suit that to hearts so untried and fresh it was a shock
to come into the inheritance of a protracted misery attended in the
minds of many people with such dreadful recollections I had another
uneasiness in the application of the painful story to the poor
halfwitted creature who had brought us there but to my surprise
she seemed perfectly unconscious of that and only led the way
upstairs again informing ",F,F,F,True
"ely honoured I am sure said our poor hostess with the
greatest suavity by this visit from the wards in Jarndyce And very
much indebted for the omen It is a retired situation Considering I
am limited as to situation In consequence of the necessity of
attending on the Chancellor I have lived here many years I pass my
days in court my evenings and my nights here I find the nights
long for I sleep but little and think much That is of course
unavoidable being in Chancery I am sorry I cannot offer cho",F,F,F,True
"colate
I expect a judgment shortly and shall then place my establishment on
a superior footing At present I dont mind confessing to the wards
in Jarndyce in strict confidence that I sometimes find it difficult
to keep up a genteel appearance I have felt the cold here I have
felt something sharper than cold It matters very little Pray excuse
the introduction of such mean topics

She partly drew aside the curtain of the long low garret window and
called our attention to a number of birdcages hangi",F,F,F,True
"ng there some
containing several birds There were larks linnets and
goldfinchesI should think at least twenty

I began to keep the little creatures she said with an object
that the wards will readily comprehend With the intention of
restoring them to liberty When my judgment should be given Yees
They die in prison though Their lives poor silly things are so
short in comparison with Chancery proceedings that one by one the
whole collection has died over and over again I doubt do you know
whether ",F,F,F,True
"t her natural cruelty is
sharpened by a jealous fear of their regaining their liberty In
consequence of the judgment I expect being shortly given She is sly
and full of malice I half believe sometimes that she is no cat
but the wolf of the old saying It is so very difficult to keep her
from the door

Some neighbouring bells reminding the poor soul that it was
halfpast nine did more for us in the way of bringing our visit to
an end than we could easily have done for ourselves She hurriedly
took u",F,F,F,True
"p her little bag of documents which she had laid upon the
table on coming in and asked if we were also going into court On
our answering no and that we would on no account detain her she
opened the door to attend us downstairs

With such an omen it is even more necessary than usual that I
should be there before the Chancellor comes in said she for he
might mention my case the first thing I have a presentiment that he
WILL mention it the first thing this morning

She stopped to tell us in a whisp",F,F,F,True
"te
market in search of me and all the other children got up behind the
barouche and fell off and we saw them with great concern scattered
over the surface of Thavies Inn as we rolled out of its precincts




CHAPTER VI

Quite at Home


The day had brightened very much and still brightened as we went
westward We went our way through the sunshine and the fresh air
wondering more and more at the extent of the streets the brilliancy
of the shops the great traffic and the crowds of people whom the
pl",F,F,F,True
