Chunks,NLTK,spaCy,NLTK U spaCy,No_Names
"llow liquor defiles them which is offensive to the touch
and sight and more offensive to the smell A stagnant sickening oil
with some natural repulsion in it that makes them both shudder

What have you been doing here What have you been pouring out of
window

I pouring out of window Nothing I swear Never since I have been
here cries the lodger

And yet look hereand look here When he brings the candle here
from the corner of the windowsill it slowly drips and creeps away
down the bricks here lies",F,F,F,True
"e cat says Mr Guppy Look at her

Mad I think And no wonder in this evil place

They advance slowly looking at all these things The cat remains
where they found her still snarling at the something on the ground
before the fire and between the two chairs What is it Hold up the
light

Here is a small burnt patch of flooring here is the tinder from a
little bundle of burnt paper but not so light as usual seeming to
be steeped in something and here isis it the cinder of a small
charred and broken log",F,F,F,True
"made and where injustice
is done Call the death by any name your Highness will attribute
it to whom you will or say it might have been prevented how you
will it is the same death eternallyinborn inbred engendered
in the corrupted humours of the vicious body itself and that
onlyspontaneous combustion and none other of all the deaths that
can be died




CHAPTER XXXIII

Interlopers


Now do those two gentlemen not very neat about the cuffs and buttons
who attended the last coroners inquest at the ",F,F,F,True
"l newcomers some version of the night they have had of it and of
what they said and what they thought and what they saw Meanwhile
one or other of the policemen often flits about the door and pushing
it open a little way at the full length of his arm looks in from
outer gloom Not that he has any suspicions but that he may as well
know what they are up to in there

Thus night pursues its leaden course finding the court still out of
bed through the unwonted hours still treating and being treated
st",F,F,F,True
"ill conducting itself similarly to a court that has had a little
money left it unexpectedly Thus night at length with slowretreating
steps departs and the lamplighter going his rounds like an
executioner to a despotic king strikes off the little heads of fire
that have aspired to lessen the darkness Thus the day cometh
whether or no

And the day may discern even with its dim London eye that the court
has been up all night Over and above the faces that have fallen
drowsily on tables and the heels",F,F,F,True
" B is induced to do so at a considerable extra expense in
consequence of a wish which has been very generally expressed at the
bar by a large body of respectable individuals and in homage to a
late melancholy event which has aroused so much sensation There is
one point connected with the deceased upon which the court is
particularly anxious namely that the fiction of a fullsized coffin
should be preserved though there is so little to put in it Upon the
undertakers stating in the Sols bar in the ",F,F,F,True
"ouse as large as life in fact
considerably larger making a very temple of it Similarly being
permitted to look in at the door of the fatal chamber he depicts
that apartment as threequarters of a mile long by fifty yards high
at which the court is particularly charmed All this time the two
gentlemen before mentioned pop in and out of every house and assist
at the philosophical disputationsgo everywhere and listen to
everybodyand yet are always diving into the Sols parlour and
writing with the rav",F,F,F,True
" which dread and watching enfolded in the Sols Arms
have produced the young man of the name of Guppy presents himself at
the town mansion at about seven oclock in the evening and requests
to see her ladyship Mercury replies that she is going out to dinner
dont he see the carriage at the door Yes he does see the carriage
at the door but he wants to see my Lady too

Mercury is disposed as he will presently declare to a
fellowgentleman in waiting to pitch into the young man but his
instructions are",F,F,F,True
"d
disappointed and uneasy is put at a further disadvantage by the
splendour and beauty of her appearance

She knows its influence perfectly has studied it too well to miss a
grain of its effect on any one As she looks at him so steadily and
coldly he not only feels conscious that he has no guide in the least
perception of what is really the complexion of her thoughts but also
that he is being every moment as it were removed further and
further from her

She will not speak it is plain So he must
",F,F,F,True
"es which ornamental object has not that tenacious
capacity of sticking to its post that might be desired in an article
long associated with the British army The old girls umbrella is of
a flabby habit of waist and seems to be in need of staysan
appearance that is possibly referable to its having served through a
series of years at home as a cupboard and on journeys as a carpet
bag She never puts it up having the greatest reliance on her
wellproved cloak with its capacious hood but generally uses",F,F,F,True
"nt the lawyer proceeds in his dry passionless manner far
more hopeless in the dealing with than any amount of vehemence make
up your mind while I speak to you for this is final After I have
finished speaking I have closed the subject and I wont reopen it
Understand that You can leave here for a few days what you say you
have brought here if you choose you can take it away at once if you
choose In case you choose to leave it here I can do this for youI
can replace this matter on its old footing a",F,F,F,True
"e street a bit




CHAPTER XXXV

Esthers Narrative


I lay ill through several weeks and the usual tenor of my life
became like an old remembrance But this was not the effect of time
so much as of the change in all my habits made by the helplessness
and inaction of a sickroom Before I had been confined to it many
days everything else seemed to have retired into a remote distance
where there was little or no separation between the various stages of
my life which had been really divided by years I",F,F,F,True
"n falling ill I
seemed to have crossed a dark lake and to have left all my
experiences mingled together by the great distance on the healthy
shore

My housekeeping duties though at first it caused me great anxiety to
think that they were unperformed were soon as far off as the oldest
of the old duties at Greenleaf or the summer afternoons when I went
home from school with my portfolio under my arm and my childish
shadow at my side to my godmothers house I had never known before
how short life re",F,F,F,True
"ally was and into how small a space the mind could
put it

While I was very ill the way in which these divisions of time became
confused with one another distressed my mind exceedingly At once a
child an elder girl and the little woman I had been so happy as I
was not only oppressed by cares and difficulties adapted to each
station but by the great perplexity of endlessly trying to reconcile
them I suppose that few who have not been in such a condition can
quite understand what I mean or what pa",F,F,F,True
"well yet I would find myself complaining Oh more of
these neverending stairs Charleymore and morepiled up to the
sky I think and labouring on again

Dare I hint at that worse time when strung together somewhere in
great black space there was a flaming necklace or ring or starry
circle of some kind of which I was one of the beads And when my
only prayer was to be taken off from the rest and when it was such
inexplicable agony and misery to be a part of the dreadful thing

Perhaps the less I say o",F,F,F,True
"f these sick experiences the less tedious
and the more intelligible I shall be I do not recall them to make
others unhappy or because I am now the least unhappy in remembering
them It may be that if we knew more of such strange afflictions we
might be the better able to alleviate their intensity

The repose that succeeded the long delicious sleep the blissful
rest when in my weakness I was too calm to have any care for myself
and could have heard or so I think now that I was dying with no
other ",F,F,F,True
" dear girl I had long knownwho could
know betterwhat a deep fountain of affection and generosity his
heart was and was it not worth my trivial suffering and change to
fill such a place in it Oh yes I thought He has seen me and
he loves me better than he did he has seen me and is even fonder of
me than he was before and what have I to mourn for

He sat down by me on the sofa supporting me with his arm For a
little while he sat with his hand over his face but when he removed
it fell into his usual",F,F,F,True
"suspects megoes to lawyers and is taught to mistrust and suspect
me Hears I have conflicting interests claims clashing against his
and what not Whereas heaven knows that if I could get out of the
mountains of Wiglomeration on which my unfortunate name has been so
long bestowed which I cant or could level them by the extinction
of my own original right which I cant either and no human power
ever can anyhow I believe to such a pass have we got I would do
it this hour I would rather restore to poor",F,F,F,True
"young man so
unfortunate here he fell into a lower tone as if he were thinking
aloud cannot at first believe who could that Chancery is what it
is He looks to it flushed and fitfully to do something with his
interests and bring them to some settlement It procrastinates
disappoints tries tortures him wears out his sanguine hopes and
patience thread by thread but he still looks to it and hankers
after it and finds his whole world treacherous and hollow Well
well well Enough of this my dear

He had",F,F,F,True
"hope it was not a poor thing in me to wish to be a little more used
to my altered self before I met the eyes of the dear girl I longed so
ardently to see but it is the truth I did He understood me I was
sure but I was not afraid of that If it were a poor thing I knew
he would pass it over

Our spoilt little woman said my guardian shall have her own way
even in her inflexibility though at the price I know of tears
downstairs And see here Here is Boythorn heart of chivalry
breathing such ferocious",F,F,F,True
" and truehearted and to do good to some
one and win some love to myself if I could came back into my mind
with a reproachful sense of all the happiness I had since enjoyed and
all the affectionate hearts that had been turned towards me If I
were weak now what had I profited by those mercies I repeated the
old childish prayer in its old childish words and found that its old
peace had not departed from it

My guardian now came every day In a week or so more I could walk
about our rooms and hold lo",F,F,F,True
" out how it was and I was drawn to stay there

Having got over her own short narrative in the delivery of which she
had spoken in a low strained voice as if the shock were fresh upon
her she gradually resumed her usual air of amiable importance

You dont quite credit me my dear Well well You will some day
I am a little rambling But I have noticed I have seen many new
faces come unsuspicious within the influence of the mace and seal
in these many years As my fathers came there As my brothers As
m",F,F,F,True
"o sadly illustrated in her poor pinched form that made its
way through all her incoherence But happily for her she was quite
complacent again now and beamed with nods and smiles

But my dear she said gaily reaching another hand to put it upon
mine You have not congratulated me on my physician Positively not
once yet

I was obliged to confess that I did not quite know what she meant

My physician Mr Woodcourt my dear who was so exceedingly
attentive to me Though his services were rendered quite
g",F,F,F,True
"ly then for my eyes were so dimmed that I could not see the
words and I cried so much that I was many times obliged to lay down
the long account she had cut out of the newspaper I felt so
triumphant ever to have known the man who had done such generous and
gallant deeds I felt such glowing exultation in his renown I so
admired and loved what he had done that I envied the stormworn
people who had fallen at his feet and blessed him as their preserver
I could myself have kneeled down then so far aw",F,F,F,True
"ay and blessed him
in my rapture that he should be so truly good and brave I felt that
no onemother sister wifecould honour him more than I I did
indeed

My poor little visitor made me a present of the account and when as
the evening began to close in she rose to take her leave lest she
should miss the coach by which she was to return she was still full
of the shipwreck which I had not yet sufficiently composed myself to
understand in all its details

My dear said she as she carefully folded up ",F,F,F,True
"say that Surely
you know my dear that all the greatest ornaments of England in
knowledge imagination active humanity and improvement of every
sort are added to its nobility Look round you my dear and
consider YOU must be rambling a little now I think if you dont
know that this is the great reason why titles will always last in the
land

I am afraid she believed what she said for there were moments when
she was very mad indeed

And now I must part with the little secret I have thus far tried to
k",F,F,F,True
"

Oh it was so much better as it was With a great pang mercifully
spared me I could take back to my heart my childish prayer to be all
he had so brightly shown himself and there was nothing to be undone
no chain for me to break or for him to drag and I could go please
God my lowly way along the path of duty and he could go his nobler
way upon its broader road and though we were apart upon the journey
I might aspire to meet him unselfishly innocently better far than
he had thought me when I found",F,F,F,True
"it yet This was my first gain from my
illness How little I had lost when the wide world was so full of
delight for me

My guardian intending to go back immediately we appointed on our
way down a day when my dear girl should come I wrote her a letter
of which he took charge and he left us within half an hour of our
arrival at our destination on a delightful evening in the early
summertime

If a good fairy had built the house for me with a wave of her wand
and I had been a princess and her favoure",F,F,F,True
"ght a little more

My hair had not been cut off though it had been in danger more than
once It was long and thick I let it down and shook it out and
went up to the glass upon the dressingtable There was a little
muslin curtain drawn across it I drew it back and stood for a moment
looking through such a veil of my own hair that I could see nothing
else Then I put my hair aside and looked at the reflection in the
mirror encouraged by seeing how placidly it looked at me I was very
much changedoh ve",F,F,F,True
"ry very much At first my face was so strange to
me that I think I should have put my hands before it and started back
but for the encouragement I have mentioned Very soon it became more
familiar and then I knew the extent of the alteration in it better
than I had done at first It was not like what I had expected but I
had expected nothing definite and I dare say anything definite would
have surprised me

I had never been a beauty and had never thought myself one but I had
been very different fro",F,F,F,True
"s
generous towards him to do it I wished to be generous to him even
in the secret depths of my heart which he would never know because
I could have loved himcould have been devoted to him At last I
came to the conclusion that I might keep them if I treasured them
only as a remembrance of what was irrevocably past and gone never to
be looked back on any more in any other light I hope this may not
seem trivial I was very much in earnest

I took care to be up early in the morning and to be before t",F,F,F,True
" trotting about with something to eat or
drink in her hand I could not even be heard of as resting in the
park but she would come trotting after me with a basket her cheerful
face shining with a lecture on the importance of frequent
nourishment Then there was a pony expressly for my riding a chubby
pony with a short neck and a mane all over his eyes who could
canterwhen he wouldso easily and quietly that he was a treasure
In a very few days he would come to me in the paddock when I called
him an",F,F,F,True
"ld old woman who lived in such a little thatched and
whitewashed dwelling that when the outside shutter was turned up on
its hinges it shut up the whole housefront This old lady had a
grandson who was a sailor and I wrote a letter to him for her and
drew at the top of it the chimneycorner in which she had brought him
up and where his old stool yet occupied its old place This was
considered by the whole village the most wonderful achievement in the
world but when an answer came back all the way f",F,F,F,True
" great consolation how natural it is to gentle
hearts to be considerate and delicate towards any inferiority One of
these particularly touched me I happened to stroll into the little
church when a marriage was just concluded and the young couple had
to sign the register

The bridegroom to whom the pen was handed first made a rude cross
for his mark the bride who came next did the same Now I had
known the bride when I was last there not only as the prettiest girl
in the place but as having quite ",F,F,F,True
"distinguished herself in the
school and I could not help looking at her with some surprise She
came aside and whispered to me while tears of honest love and
admiration stood in her bright eyes Hes a dear good fellow miss
but he cant write yethes going to learn of meand I wouldnt
shame him for the world Why what had I to fear I thought when
there was this nobility in the soul of a labouring mans daughter

The air blew as freshly and revivingly upon me as it had ever blown
and the healthy colour c",F,F,F,True
"e that was said to haunt it
when I became aware of a figure approaching through the wood The
perspective was so long and so darkened by leaves and the shadows of
the branches on the ground made it so much more intricate to the eye
that at first I could not discern what figure it was By little and
little it revealed itself to be a womansa ladysLady Dedlocks
She was alone and coming to where I sat with a much quicker step I
observed to my surprise than was usual with her

I was fluttered by her be",F,F,F,True
"ing unexpectedly so near she was almost
within speaking distance before I knew her and would have risen to
continue my walk But I could not I was rendered motionless Not so
much by her hurried gesture of entreaty not so much by her quick
advance and outstretched hands not so much by the great change in
her manner and the absence of her haughty selfrestraint as by a
something in her face that I had pined for and dreamed of when I was
a little child something I had never seen in any face something",F,F,F,True
" fell down on her knees and
cried to me Oh my child my child I am your wicked and unhappy
mother Oh try to forgive mewhen I saw her at my feet on the
bare earth in her great agony of mind I felt through all my tumult
of emotion a burst of gratitude to the providence of God that I was
so changed as that I never could disgrace her by any trace of
likeness as that nobody could ever now look at me and look at her
and remotely think of any near tie between us

I raised my mother up praying and beseec",F,F,F,True
"hing her not to stoop before
me in such affliction and humiliation I did so in broken incoherent
words for besides the trouble I was in it frightened me to see her
at MY feet I told heror I tried to tell herthat if it were for
me her child under any circumstances to take upon me to forgive
her I did it and had done it many many years I told her that my
heart overflowed with love for her that it was natural love which
nothing in the past had changed or could change That it was not for
me then res",F,F,F,True
"ting for the first time on my mothers bosom to take her
to account for having given me life but that my duty was to bless
her and receive her though the whole world turned from her and that
I only asked her leave to do it I held my mother in my embrace and
she held me in hers and among the still woods in the silence of the
summer day there seemed to be nothing but our two troubled minds that
was not at peace

To bless and receive me groaned my mother it is far too late I
must travel my dark road",F,F,F,True
" alone and it will lead me where it will
From day to day sometimes from hour to hour I do not see the way
before my guilty feet This is the earthly punishment I have brought
upon myself I bear it and I hide it

Even in the thinking of her endurance she drew her habitual air of
proud indifference about her like a veil though she soon cast it off
again

I must keep this secret if by any means it can be kept not wholly
for myself I have a husband wretched and dishonouring creature that
I am

These ",F,F,F,True
"words she uttered with a suppressed cry of despair more
terrible in its sound than any shriek Covering her face with her
hands she shrank down in my embrace as if she were unwilling that I
should touch her nor could I by my utmost persuasions or by any
endearments I could use prevail upon her to rise She said no no
no she could only speak to me so she must be proud and disdainful
everywhere else she would be humbled and ashamed there in the only
natural moments of her life

My unhappy mother tol",F,F,F,True
"d me that in my illness she had been nearly
frantic She had but then known that her child was living She could
not have suspected me to be that child before She had followed me
down here to speak to me but once in all her life We never could
associate never could communicate never probably from that time
forth could interchange another word on earth She put into my hands
a letter she had written for my reading only and said when I had read
it and destroyed itbut not so much for her sake since sh",F,F,F,True
"e asked
nothing as for her husbands and my ownI must evermore consider
her as dead If I could believe that she loved me in this agony in
which I saw her with a mothers love she asked me to do that for
then I might think of her with a greater pity imagining what she
suffered She had put herself beyond all hope and beyond all help
Whether she preserved her secret until death or it came to be
discovered and she brought dishonour and disgrace upon the name she
had taken it was her solitary struggle ",F,F,F,True
"he acquisition of secrets and the holding
possession of such power as they give him with no sharer or opponent
in it

Could you trust in him

I shall never try The dark road I have trodden for so many years
will end where it will I follow it alone to the end whatever the
end be It may be near it may be distant while the road lasts
nothing turns me

Dear mother are you so resolved

I AM resolved I have long outbidden folly with folly pride with
pride scorn with scorn insolence with insolence and ",F,F,F,True
"d I that perhaps if he knew

My mother who until this time had made no change in her position
raised her hand up to my lips and stopped me

Confide fully in him she said after a little while You have my
free consenta small gift from such a mother to her injured
childbut do not tell me of it Some pride is left in me even yet

I explained as nearly as I could then or can recall nowfor my
agitation and distress throughout were so great that I scarcely
understood myself though every word that was ut",F,F,F,True
" murdering
within her breast the only love and truth of which it is capable And
then forgive her if you can and cry to heaven to forgive her which
it never can

We held one another for a little space yet but she was so firm that
she took my hands away and put them back against my breast and with
a last kiss as she held them there released them and went from me
into the wood I was alone and calm and quiet below me in the sun
and shade lay the old house with its terraces and turrets on which
there",F,F,F,True
" my
mother Her elder and only sister the godmother of my childhood
discovering signs of life in me when I had been laid aside as dead
had in her stern sense of duty with no desire or willingness that I
should live reared me in rigid secrecy and had never again beheld my
mothers face from within a few hours of my birth So strangely did I
hold my place in this world that until within a short time back I had
never to my own mothers knowledge breathedhad been buriedhad
never been endowed with lifeha",F,F,F,True
"d never borne a name When she had
first seen me in the church she had been startled and had thought of
what would have been like me if it had ever lived and had lived on
but that was all then

What more the letter told me needs not to be repeated here It has
its own times and places in my story

My first care was to burn what my mother had written and to consume
even its ashes I hope it may not appear very unnatural or bad in me
that I then became heavily sorrowful to think I had ever been reare",F,F,F,True
"d
That I felt as if I knew it would have been better and happier for
many people if indeed I had never breathed That I had a terror of
myself as the danger and the possible disgrace of my own mother and
of a proud family name That I was so confused and shaken as to be
possessed by a belief that it was right and had been intended that I
should die in my birth and that it was wrong and not intended that I
should be then alive

These are the real feelings that I had I fell asleep worn out and
when ",F,F,F,True
