Chunks,NLTK,spaCy,NLTK U spaCy,No_Names
"nge of trees
against the sky with the grey ghost of a bloom upon them not only is
it a still night in gardens and in woods and on the river where the
watermeadows are fresh and green and the stream sparkles on among
pleasant islands murmuring weirs and whispering rushes not only
does the stillness attend it as it flows where houses cluster thick
where many bridges are reflected in it where wharves and shipping
make it black and awful where it winds from these disfigurements
through marshes whose",F,F,F,True
" grim beacons stand like skeletons washed
ashore where it expands through the bolder region of rising grounds
rich in cornfield windmill and steeple and where it mingles with
the everheaving sea not only is it a still night on the deep and
on the shore where the watcher stands to see the ship with her spread
wings cross the path of light that appears to be presented to only
him but even on this strangers wilderness of London there is some
rest Its steeples and towers and its one great dome grow ",F,F,F,True
"more
ethereal its smoky housetops lose their grossness in the pale
effulgence the noises that arise from the streets are fewer and are
softened and the footsteps on the pavements pass more tranquilly
away In these fields of Mr Tulkinghorns inhabiting where the
shepherds play on Chancery pipes that have no stop and keep their
sheep in the fold by hook and by crook until they have shorn them
exceeding close every noise is merged this moonlight night into a
distant ringing hum as if the city were a",F,F,F,True
" vast glass vibrating

Whats that Who fired a gun or pistol Where was it

The few footpassengers start stop and stare about them Some
windows and doors are opened and people come out to look It was a
loud report and echoed and rattled heavily It shook one house or so
a man says who was passing It has aroused all the dogs in the
neighbourhood who bark vehemently Terrified cats scamper across the
road While the dogs are yet barking and howlingthere is one dog
howling like a demonthe churchclocks a",F,F,F,True
"ut a little after the coming of the day come people to clean the
rooms And either the Roman has some new meaning in him not
expressed before or the foremost of them goes wild for looking up
at his outstretched hand and looking down at what is below it that
person shrieks and flies The others looking in as the first one
looked shriek and fly too and there is an alarm in the street

What does it mean No light is admitted into the darkened chamber
and people unaccustomed to it enter and treading so",F,F,F,True
"ftly but heavily
carry a weight into the bedroom and lay it down There is whispering
and wondering all day strict search of every corner careful tracing
of steps and careful noting of the disposition of every article of
furniture All eyes look up at the Roman and all voices murmur If
he could only tell what he saw

He is pointing at a table with a bottle nearly full of wine and a
glass upon it and two candles that were blown out suddenly soon after
being lighted He is pointing at an empty chair ",F,F,F,True
"and at a stain upon
the ground before it that might be almost covered with a hand These
objects lie directly within his range An excited imagination might
suppose that there was something in them so terrific as to drive the
rest of the composition not only the attendant biglegged boys but
the clouds and flowers and pillars tooin short the very body and
soul of Allegory and all the brains it hasstark mad It happens
surely that every one who comes into the darkened room and looks at
these things l",F,F,F,True
"for the old girl that she has but one birthday in a year
for two such indulgences in poultry might be injurious Every kind of
finer tendon and ligament that is in the nature of poultry to possess
is developed in these specimens in the singular form of
guitarstrings Their limbs appear to have struck roots into their
breasts and bodies as aged trees strike roots into the earth Their
legs are so hard as to encourage the idea that they must have devoted
the greater part of their long and arduous liv",F,F,F,True
"other trial to undergo after the conclusion of the
repast in sitting in state to see the room cleared the hearth swept
and the dinnerservice washed up and polished in the backyard The
great delight and energy with which the two young ladies apply
themselves to these duties turning up their skirts in imitation of
their mother and skating in and out on little scaffolds of pattens
inspire the highest hopes for the future but some anxiety for the
present The same causes lead to confusion of tongues ",F,F,F,True
"ian All of us I have a great regard for
Woodcourt a high esteem for him and I have been sounding him
delicately about his plans It is difficult to offer aid to an
independent man with that just kind of pride which he possesses And
yet I would be glad to do it if I might or if I knew how He seems
half inclined for another voyage But that appears like casting such
a man away

It might open a new world to him said I

So it might little woman my guardian assented I doubt if he
expects much of the ol",F,F,F,True
" through

I dont quite know what to think my dear but I should say it was
likely at present that he will give a long trip to another country

I am sure he will take the best wishes of all our hearts with him
wherever he goes said I and though they are not riches he will
never be the poorer for them guardian at least

Never little woman he replied

I was sitting in my usual place which was now beside my guardians
chair That had not been my usual place before the letter but it was
now I looked up ",F,F,F,True
"rawer near her
which was not quite closed I did not open the drawer but I still
rather wondered what the work could be for it was evidently nothing
for herself

And I noticed as I kissed my dear that she lay with one hand under
her pillow so that it was hidden

How much less amiable I must have been than they thought me how much
less amiable than I thought myself to be so preoccupied with my own
cheerfulness and contentment as to think that it only rested with me
to put my dear girl right and se",F,F,F,True
"d play more funds must be provided unless Mr C
is to throw away what he has already ventured which is wholly and
solely a point for his consideration This sir I take the
opportunity of stating openly to you as the friend of Mr C Without
funds I shall always be happy to appear and act for Mr C to the
extent of all such costs as are safe to be allowed out of the estate
not beyond that I could not go beyond that sir without wronging
some one I must either wrong my three dear girls or my venerable
f",F,F,F,True
"in
a moment and said with his natural openness Woodcourt I should be
sorry to be misunderstood by you even if I gained by it in your
estimation You must know that I have done no good this long time I
have not intended to do much harm but I seem to have been capable of
nothing else It may be that I should have done better by keeping out
of the net into which my destiny has worked me but I think not
though I dare say you will soon hear if you have not already heard
a very different opinion To make",F,F,F,True
"erce in
its determination to be it was so hungry and eager and yet so
conscious of being forced and unsustainable that it had long touched
me to the heart But the commentary upon it now indelibly written in
his handsome face made it far more distressing than it used to be I
say indelibly for I felt persuaded that if the fatal cause could
have been for ever terminated according to his brightest visions in
that same hour the traces of the premature anxiety selfreproach
and disappointment it had oc",F,F,F,True
"much

How selfish I must have been not to have thought of this before I
dont know what I said now I was so sorry and yet I was so fond of
them and so glad that they were fond of me I pitied them so much
and yet I felt a kind of pride in their loving one another I never
had experienced such painful and pleasurable emotion at one time and
in my own heart I did not know which predominated But I was not
there to darken their way I did not do that

When I was less foolish and more composed my darling",F,F,F,True
"m coming back so soon

I had given my darling to him now and I meant to go but I lingered
for one more look of the precious face which it seemed to rive my
heart to turn from

So I said in a merry bustling manner that unless they gave me some
encouragement to come back I was not sure that I could take that
liberty upon which my dear girl looked up faintly smiling through
her tears and I folded her lovely face between my hands and gave it
one last kiss and laughed and ran away

And when I got dow",F,F,F,True
"n dead though I did not know it My guardian had gone out to
inquire about him and did not return to dinner Being quite alone I
cried a little again though on the whole I dont think I behaved so
very very ill

It was only natural that I should not be quite accustomed to the loss
of my darling yet Three or four hours were not a long time after
years But my mind dwelt so much upon the uncongenial scene in which
I had left her and I pictured it as such an overshadowed
stonyhearted one and I so longe",F,F,F,True
"n
him a dangerous and secret enemy appeared so awful that my first
thoughts were of her How appalling to hear of such a death and be
able to feel no pity How dreadful to remember perhaps that she had
sometimes even wished the old man away who was so swiftly hurried out
of life

Such crowding reflections increasing the distress and fear I always
felt when the name was mentioned made me so agitated that I could
scarcely hold my place at the table I was quite unable to follow the
conversation until",F,F,F,True
" I had had a little time to recover But when I
came to myself and saw how shocked my guardian was and found that
they were earnestly speaking of the suspected man and recalling every
favourable impression we had formed of him out of the good we had
known of him my interest and my fears were so strongly aroused in
his behalf that I was quite set up again

Guardian you dont think it possible that he is justly accused

My dear I CANT think so This man whom we have seen so
openhearted and compassion",F,F,F,True
"ate who with the might of a giant has the
gentleness of a child who looks as brave a fellow as ever lived and
is so simple and quiet with it this man justly accused of such a
crime I cant believe it Its not that I dont or I wont I
cant

And I cant said Mr Woodcourt Still whatever we believe or
know of him we had better not forget that some appearances are
against him He bore an animosity towards the deceased gentleman He
has openly mentioned it in many places He is said to have expressed
himself",F,F,F,True
"er very much and that he liked me I had that secret
interest in what had happened which was only known to my guardian I
felt as if it came close and near to me It seemed to become
personally important to myself that the truth should be discovered
and that no innocent people should be suspected for suspicion once
run wild might run wilder

In a word I felt as if it were my duty and obligation to go with
them My guardian did not seek to dissuade me and I went

It was a large prison with many court",F,F,F,True
"s and passages so like one
another and so uniformly paved that I seemed to gain a new
comprehension as I passed along of the fondness that solitary
prisoners shut up among the same staring walls from year to year
have hadas I have readfor a weed or a stray blade of grass In an
arched room by himself like a cellar upstairs with walls so
glaringly white that they made the massive iron windowbars and
ironbound door even more profoundly black than they were we found
the trooper standing in a corner ",F,F,F,True
"He had been sitting on a bench
there and had risen when he heard the locks and bolts turn

When he saw us he came forward a step with his usual heavy tread
and there stopped and made a slight bow But as I still advanced
putting out my hand to him he understood us in a moment

This is a load off my mind I do assure you miss and gentlemen
said he saluting us with great heartiness and drawing a long breath
And now I dont so much care how it ends

He scarcely seemed to be the prisoner What with his ",F,F,F,True
"t till it dont know
itself and as aforesaid here I am I dont particular complain of
that Though I am in these present quarters through no immediately
preceding fault of mine I can very well understand that if I hadnt
gone into the vagabond way in my youth this wouldnt have happened
It HAS happened Then comes the question how to meet it

He rubbed his swarthy forehead for a moment with a goodhumoured look
and said apologetically I am such a shortwinded talker that I must
think a bit Having though",F,F,F,True
"y
own wayif youll excuse my mentioning anything so disagreeable to a
lady

He had warmed into his subject now and was under no further
necessity to wait a bit

I would rather be hanged in my own way And I mean to be I dont
intend to say looking round upon us with his powerful arms akimbo
and his dark eyebrows raised that I am more partial to being hanged
than another man What I say is I must come off clear and full or
not at all Therefore when I hear stated against me what is true I
say its true",F,F,F,True
" and when they tell me whatever you say will be
used I tell them I dont mind that I mean it to be used If they
cant make me innocent out of the whole truth they are not likely to
do it out of anything less or anything else And if they are its
worth nothing to me

Taking a pace or two over the stone floor he came back to the table
and finished what he had to say

I thank you miss and gentlemen both many times for your attention
and many times more for your interest Thats the plain state of the
ma",F,F,F,True
"tter as it points itself out to a mere trooper with a blunt
broadsword kind of a mind I have never done well in life beyond my
duty as a soldier and if the worst comes after all I shall reap
pretty much as I have sown When I got over the first crash of being
seized as a murdererit dont take a rover who has knocked about so
much as myself so very long to recover from a crashI worked my way
round to what you find me now As such I shall remain No relations
will be disgraced by me or made unhappy fo",F,F,F,True
"ather
languishing for want of an object He is in the friendliest condition
towards his species and will drink with most of them He is free with
his money affable in his manners innocent in his conversationbut
through the placid stream of his life there glides an undercurrent
of forefinger

Time and place cannot bind Mr Bucket Like man in the abstract he
is here today and gone tomorrowbut very unlike man indeed he is
here again the next day This evening he will be casually looking
into the iron e",F,F,F,True
" that much correspondence is not
incidental to his life He is no great scribe rather handling his
pen like the pocketstaff he carries about with him always convenient
to his grasp and discourages correspondence with himself in others
as being too artless and direct a way of doing delicate business
Further he often sees damaging letters produced in evidence and has
occasion to reflect that it was a green thing to write them For
these reasons he has very little to do with letters either as sender
",F,F,F,True
"n my name A gentleman who has devoted a
large portion of his life to me a gentleman who has devoted the last
day of his life to me a gentleman who has constantly sat at my table
and slept under my roof goes from my house to his own and is struck
down within an hour of his leaving my house I cannot say but that he
may have been followed from my house watched at my house even first
marked because of his association with my housewhich may have
suggested his possessing greater wealth and being altog",F,F,F,True
"ether of
greater importance than his own retiring demeanour would have
indicated If I cannot with my means and influence and my position
bring all the perpetrators of such a crime to light I fail in the
assertion of my respect for that gentlemans memory and of my
fidelity towards one who was ever faithful to me

While he makes this protestation with great emotion and earnestness
looking round the room as if he were addressing an assembly Mr
Bucket glances at him with an observant gravity in whic",F,F,F,True
" we now in
the mansions of the rich and great my friends Is it because we are
invited Because we are bidden to feast with them because we are
bidden to rejoice with them because we are bidden to play the lute
with them because we are bidden to dance with them No Then why are
we here my friends Air we in possession of a sinful secret and do
we require corn and wine and oil or what is much the same thing
money for the keeping thereof Probably so my friends

Youre a man of business you are returns ",F,F,F,True
"te hair and his extended arms

It is she in association with whom saving that she has been for
years a main fibre of the root of his dignity and pride he has never
had a selfish thought It is she whom he has loved admired
honoured and set up for the world to respect It is she who at the
core of all the constrained formalities and conventionalities of his
life has been a stock of living tenderness and love susceptible as
nothing else is of being struck with the agony he feels He sees her
almost t",F,F,F,True
"o the exclusion of himself and cannot bear to look upon her
cast down from the high place she has graced so well

And even to the point of his sinking on the ground oblivious of his
suffering he can yet pronounce her name with something like
distinctness in the midst of those intrusive sounds and in a tone of
mourning and compassion rather than reproach




CHAPTER LV

Flight


Inspector Bucket of the Detective has not yet struck his great blow
as just now chronicled but is yet refreshing himsel",F,F,F,True
"f with sleep
preparatory to his fieldday when through the night and along the
freezing wintry roads a chaise and pair comes out of Lincolnshire
making its way towards London

Railroads shall soon traverse all this country and with a rattle and
a glare the engine and train shall shoot like a meteor over the wide
nightlandscape turning the moon paler but as yet such things are
nonexistent in these parts though not wholly unexpected
Preparations are afoot measurements are made ground is staked out
",F,F,F,True
"Bridges are begun and their not yet united piers desolately look at
one another over roads and streams like brick and mortar couples with
an obstacle to their union fragments of embankments are thrown up
and left as precipices with torrents of rusty carts and barrows
tumbling over them tripods of tall poles appear on hilltops where
there are rumours of tunnels everything looks chaotic and abandoned
in full hopelessness Along the freezing roads and through the
night the postchaise makes its way w",F,F,F,True
" the Island of Ascension Hong Kong or any
other military station

But when they set out for the prison where the trooper is
confined the old lady has managed to draw about her with her
lavendercoloured dress much of the staid calmness which is its
usual accompaniment A wonderfully grave precise and handsome piece
of old china she looks though her heart beats fast and her stomacher
is ruffled more than even the remembrance of this wayward son has
ruffled it these many years

Approaching the cell ",F,F,F,True
"respected and esteemed There was my brother as I read in chance
North Country papers now and then rising to be prosperous and
famous There was I a dragoon roving unsettled not selfmade like
him but selfunmadeall my earlier advantages thrown away all my
little learning unlearnt nothing picked up but what unfitted me for
most things that I could think of What business had I to make myself
known After letting all that time go by me what good could come of
it The worst was past with you mother I kne",F,F,F,True
"w by that time being a
man how you had mourned for me and wept for me and prayed for me
and the pain was over or was softened down and I was better in your
mind as it was

The old lady sorrowfully shakes her head and taking one of his
powerful hands lays it lovingly upon her shoulder

No I dont say that it was so mother but that I made it out to be
so I said just now what good could come of it Well my dear
mother some good might have come of it to myselfand there was the
meanness of it You would",F,F,F,True
"her feelings and testifies her
interest in the conversation by giving the trooper a great poke
between the shoulders with her umbrella this action she afterwards
repeats at intervals in a species of affectionate lunacy never
failing after the administration of each of these remonstrances to
resort to the whitened wall and the grey cloak again

This was the way I brought myself to think mother that my best
amends was to lie upon that bed I had made and die upon it And I
should have done it though",F,F,F,True
"at is not known to
others if you have any suspicion if you have any clue at all and
any reason for keeping it in your own breast oh my dear Lady think
of me and conquer that reason and let it be known This is the most
I consider possible I know you are not a hard lady but you go your
own way always without help and you are not familiar with your
friends and all who admire youand all doas a beautiful and
elegant lady know you to be one far away from themselves who cant
be approached close My Lady",F,F,F,True
" you may have some proud or angry
reasons for disdaining to utter something that you know if so pray
oh pray think of a faithful servant whose whole life has been
passed in this family which she dearly loves and relent and help to
clear my son My Lady my good Lady the old housekeeper pleads with
genuine simplicity I am so humble in my place and you are by nature
so high and distant that you may not think what I feel for my child
but I feel so much that I have come here to make so bold as to beg
",F,F,F,True
"per leaves her with the letter in her hand In truth
she is not a hard lady naturally and the time has been when the
sight of the venerable figure suing to her with such strong
earnestness would have moved her to great compassion But so long
accustomed to suppress emotion and keep down reality so long
schooled for her own purposes in that destructive school which shuts
up the natural feelings of the heart like flies in amber and spreads
one uniform and dreary gloss over the good and bad the feeli",F,F,F,True
"nt
of fact shouldnt have darkened these doors again but should have
seen em further first

Mr Guppy considers this a favourable moment for sticking up his hair
with both hands

Your ladyship will remember when I mention it that the last time I
was here I run against a party very eminent in our profession and
whose loss we all deplore That party certainly did from that time
apply himself to cutting in against me in a way that I will call
sharp practice and did make it at every turn and point extr",F,F,F,True
"ing things alone and in undoing what I
had begun to do as far as possible thats sufficient for me In
case I should be taking a liberty in putting your ladyship on your
guard when theres no necessity for it you will endeavour I should
hope to outlive my presumption and I shall endeavour to outlive
your disapprobation I now take my farewell of your ladyship and
assure you that theres no danger of your ever being waited on by me
again

She scarcely acknowledges these parting words by any look but w",F,F,F,True
"olt so long
foreseen by her so unforeseen by him she is denounced by an
invisible accuser as the murderess of her enemy

Her enemy he was and she has often often often wished him dead
Her enemy he is even in his grave This dreadful accusation comes
upon her like a new torment at his lifeless hand And when she
recalls how she was secretly at his door that night and how she may
be represented to have sent her favourite girl away so soon before
merely to release herself from observation she shudder",F,F,F,True
"s as if the
hangmans hands were at her neck

She has thrown herself upon the floor and lies with her hair all
wildly scattered and her face buried in the cushions of a couch She
rises up hurries to and fro flings herself down again and rocks
and moans The horror that is upon her is unutterable If she really
were the murderess it could hardly be for the moment more intense

For as her murderous perspective before the doing of the deed
however subtle the precautions for its commission would have b",F,F,F,True
"een
closed up by a gigantic dilatation of the hateful figure preventing
her from seeing any consequences beyond it and as those consequences
would have rushed in in an unimagined flood the moment the figure
was laid lowwhich always happens when a murder is done so now she
sees that when he used to be on the watch before her and she used to
think if some mortal stroke would but fall on this old man and take
him from my way it was but wishing that all he held against her in
his hand might be flung",F,F,F,True
" to the winds and chancesown in many places
So too with the wicked relief she has felt in his death What was
his death but the keystone of a gloomy arch removed and now the
arch begins to fall in a thousand fragments each crushing and
mangling piecemeal

Thus a terrible impression steals upon and overshadows her that from
this pursuer living or deadobdurate and imperturbable before her
in his wellremembered shape or not more obdurate and imperturbable
in his coffinbedthere is no escape but in de",F,F,F,True
